Unnamed: 0,book_name,summaries,categories
321,The Person You Mean to Be, teaches you how to navigate cognitive biases that may prevent you from forming meaningful relationships and experiencing the world as it is by leading you to wrongful assumptions or limitations about your environment or by anchoring you in your preexisting beliefs.,politics
322,First Principles," delves into the history of American evolution and highlights how the parents of modern thinking were inspired by Roman and Greek philosophy in their mindset, military actions, views of the world, and many more.",politics
323,The Second Sex," delves into the concept of feminism by looking at historical facts and biases, and explains how being a woman implies being subjugated to a man and making yourself smaller so that you can fit in today’s world, but also how women everywhere should react to the system and change it.",politics
324,Minor Feelings," explores the purgatory state that Asian-Americans are stuck into as immigrants who have an image of non-white and non-black people who don’t speak, disturb, or make any impression at all.",politics
325,The Authoritarian Moment," presents the America of today, where authoritarian powers seem to be taking over while putting the democracy at risk, and pleas to protect the freedom and rights that the founding fathers of democracy built centuries ago.",politics
326,"Woke, Inc."," taps into the dark secrets of the woke culture in corporate America, which organizations generate tremendous amounts of profit by hiding behind causes like social justice, gender equality, climate change, and many other popular matters.",politics
327,The Story of Philosophy," profiles the lives of great Western philosophers, such as Plato, Socrates, and Nietzsche, exploring their views on politics, religion, morality, the meaning of life, and plenty of other important concepts.",politics
328,Richard Nixon: The Life," presents the detailed biography of the thirty-seventh president of the United States, who became famous for his successful endeavors that put him in the White House and for his controversial life the complexities of being such a top tier political figure.",politics
329,How to Be a Conservative," builds the case for traditionalists and conservative people who view society through the lenses of someone who’s defending their nation, the long-lasting values of the world, the free market, and many other healthy principles. ",politics
330,The Social Contract," is a political piece of writing that serves as a pylon for the democracies of today, as it theorizes the elements of a free state where people agree to coexist with each other under the rules of a common body that represents the general will.",politics
331,An Ugly Truth," offers a critical look at Facebook and its administrators, who foster a gaslighting environment and a controversial social media platform that can easily become a danger for its users both virtually and in real life due to its immense power and influence on our society.",politics
334,Socialism," by Michael Newman outlines the history of the governmental theory that everything should be owned and controlled by the community as a whole, including how this idea has impacted the world in the last 200 years, how its original aims have been lost, and ways we might use it in the future.",politics
335,How Democracies Die," lays out the foundational principles of working democracies by looking at historical events, especially in Latin America, that show how democracies have failed in the past, how it could happen again, and how we can protect democracy from threats like bad leadership, inequality, and extremism.",politics
336,What Happened," is Hillary Clinton’s post-mortem on the events and surprising result of her bid for the 2016 United States presidential election, including why she ran for president in the first place, what made it so hard for her to come out on top, and how the loss affected her after election night.",politics
337,Hood Feminism," explores the idea that traditional feminism only seeks to improve life for white women and not all women, arguing that true equality and inclusivity means seeking to lift all women, including those of color.",politics
338,How To Be A Leader," is Greek philosopher Plutarch’s guide to leadership and uses practical ideas, historical narratives, political events, and more to outline the qualities of the best leaders, including serving for the right reasons, speaking persuasively, and following more experienced leaders.",politics
339,Dark Towers," dives into the dirty inner workings and the rise and fall of Deutsche Bank, which contributed to many notable but not always beneficial events of the past 150 years, including the American railroad system, the Nazi regime, funding Russian oligarchs, and even the election of Donald Trump.",politics
340,The Great Escape," challenges the idea that the world is on fire by declaring that things have never been better in many ways, although the advancements we’ve made and the ways they have improved many lives haven’t reached everyone equally.",politics
341,Why Nations Fail," dives into the reasons why economic inequality is so common in the world today and identifies that poor decisions of those in political power are the main reason for unfairness rather than culture, geography, climate, or any other factor.",politics
342,The Myth Of The Strong Leader," reveals why being a bold, charismatic leader might not be all it’s cracked up to be, showing that we give way too much credit to “strong” leaders and illustrating the problematic consequences this societal pattern entails.",politics
343,Ten Arguments For Deleting Your Social Media Accounts Right Now," shows why you should quit social media because it stops joy, makes you a jerk, erodes truth, kills empathy, takes free will, keeps the world insane, destroys authenticity, blocks economic dignity, makes politics a mess, and hates you.",politics
344,The End Of Power, explains why the old positions of power aren’t as powerful as they used to be due to recent changes in society and technology and how this shift has put more influence in the hands of everyday citizens like you and what it might mean for the future of our governments and world.,politics
345,Restart," tells the story of India’s almost-leadership of the world’s economy, showing why and how it instead succumbed to problems from the past, how those problems still hold it back today, and what the country might do about them.",politics
346,How To Avoid A Climate Disaster," is Bill Gates’ plea to the individuals, governments, and business leaders of the world to reduce greenhouse emissions by changing the way we make things, plug in, grow things, get around, and keep warm and cool.",politics
347,The Truths We Hold," is the autobiography of civil rights activist, Californian Senator, and Vice President Kamala Harris, which details her early years in the justice system fighting for the people and what she has been doing in the last few years to help those suffering from the inefficiencies in the United States government.",politics
348,The Big Necessity," makes you smarter about feces by explaining how sanitation works, the damage it causes when it’s not done properly, and what we can do to improve it around the world.",politics
349,White Fragility," will help you take steps toward becoming a kinder and more fair person by helping you understand why it’s so difficult for white people, especially in America, to talk about racism.",politics
350,Shattered," explains the details around Hillary Clinton’s shocking 2016 presidential election loss and explains how an FBI investigation, Bernie Sanders, infighting on her team, and overconfidence in data analytics all contributed to her defeat.",politics
351,Prisoners Of Geography," explains how the location of a country dramatically affects its success and the amount of power it has in the world, and how this has determined the outcomes of major world events for centuries.",politics
352,Green Illusions," will open your mind to the true nature of our problem with energy by explaining the potential dangers and inefficiencies of alternative energy sources like wind, hydrogen, solar, and nuclear, and identifies the real culprit of our energy crisis and how to stop it.",politics
353,Mighty Be Our Powers, shares the inspirational story of Leymah Gbowee who helped bring together an influential group of women that were tired of the unrest in their country and whose efforts eventually led to the end of a devastating and long-lasting civil war.,politics
354,A Promised Land," is former president Barack Obama’s memoir in which he explains how he got into politics, what it was like for him to be president of the United States from 2009 to 2017, and how he felt during some of his biggest achievements, like passing the Affordable Care Act.",politics
355,A Higher Loyalty," shares James Comey’s experiences as the director of the FBI and outlines what he learned about leadership, ethics, and politics throughout his life, career, and experiences with President Trump who was the reason he lost his job in May of 2017.",politics
356,The Ethics Of Ambiguity," explains existentialist philosophy in a post–World War II setting, showing us how we can accept the absurdity of life and use its randomness to create rather than despair.",politics
357,The Warmth Of Other Suns," is the story of how and why millions of Black Americans left the South between 1915 and 1970 to escape the brutality of the Jim Crow Laws and find safety, better pay, and more freedom in what is known today as The Great Migration.",politics
358,Just Mercy," explains why the United States judicial system is so broken, including how its bias toward women, Blacks, minorities, and others makes communities and the entire country a worse place and what author Bryan Stevenson is doing with his Equal Justice Initiative to try to stop these injustices.",politics
359,First They Killed My Father," is Loung Ung’s account of the horrific events that she and her family had to go through while living in Cambodia during the Khmer Rouge regime in the 1970s and explains how it devastated their country, the way it separated their family, and how Loung got through it all.",politics
360,The End Of Poverty," will help you develop a kinder and more compassionate heart by opening your eyes to the terrible state of the poorest countries in the world, how they got to be this way, and why solving this problem is in our best interests and may be easier than we think.",politics
361,On Tyranny," makes you more vigilant of the warning signs of oppression by identifying it’s political nature, how to protect yourself and society, and what you can do to resist dangerous leadership.",politics
362,The Hot Zone," is Richard Preston’s version of a terrifying true story of how the Ebola virus came to be, why it’s so deadly and contagious, and how this all reveals our massive vulnerabilities and inefficiencies when it comes to fending off pandemics of all kinds.",politics
363,Stamped From The Beginning, will open your mind to the true origins of racism by challenging your long-held beliefs about it that have been perpetrated by racists throughout history.,politics
364,Upheaval," enlightens you by telling the stories of seven countries that fell into crises, including how they got there and what they did to get out, and identifies the common threads between all of them.",politics
365,Winners Take All," helps you see the ultra-rich in a more accurate light by identifying their shady strategies, including using the idea of “making the world a better place” as a front that only serves as a way to solidify their wealth and power.",politics
366,Evicted," reveals the awful situation of those living in the poorest cities in the United States by identifying how this situation came to be, the horrendous effect it has on the individuals and families that deal with it, and what we might do to stop it.",politics
367,Dreamland," blows open the story of the United States’ opioid crisis, from the frustrating greed and oversight that created it, how drug dealers accelerated it’s spread, and what we’re doing now to stop it.",politics
368,So You Want To Talk About Race," will help you make the world a better, fairer place by explaining how deeply entrenched racism is in our culture today and giving specific tips for having effective conversations about it so you can help end this major issue with society.",politics
369,What The Eyes Don’t See," tells the shocking and unfortunate story of the public drinking water crisis in Flint, Michigan and how one woman stood up against government corruption and racism to make a positive difference for the city.",politics
370,Dark Money, dives into the depths of the greed and corruption in the American political system by revealing the story of the Koch brothers who have been enabling the ultra-wealthy to influence political decisions for decades.,politics
371,Food Fix, will help you eat healthier and improve the environment at the same time by explaining how bad our food is for us and our planet and what we can each do to fix these problems.,politics
372,Age Of Anger, will help you understand the current state of the world better by explaining how we got to this present situation of upheaval we’re in and how we might stand a chance of making things better.,politics
373,How To Be An Antiracist," will make you a better, kinder, and more fair person by revealing how deeply ingrained racism is in our society and outlining what we can all do to annihilate it completely.",politics
374,Capitalism, shows you how the movement of money in the world really works by outlining the dominant system in the world and its origins and future.,politics
375,Capitalism And Freedom, helps you understand some of the most important factors protecting your liberty by outlining the government’s role in economics and how things go best when political entities are small and stay out of the flow of money in a country.,politics
376,Cradle To Cradle," uncovers the hidden problems with manufacturing, how they affect our planet, and what you can do to help by becoming eco-efficient.",politics
377,Comfortably Unaware, is a well-researched compendium on how our food choices and animal agriculture impact the well-being of the whole planet.,politics
378,Impeachment, is your guide to understanding how the US government has the power to remove a president and reviews the events surrounding past evictions of the commander-in-chief. ,politics
379,The Road To Serfdom," helps you keep your freedoms and individuality by taking a stand against socialism, identifying its risks to turn into totalitarianism, and why this was especially important after WWII.",politics
380,Crippled America, makes you a more informed citizen by sharing the political beliefs and reasoning behind billionaire and businessman Donald J. Trump’s plans to make his country great again.,politics
381,Fear," takes an inside look through the eyes of journalist, Bob Woodward",politics
382,Brotopia, motivates you to be fairer in the workplace as an employee or employer by revealing the sad sexist state of Silicon Valley.,politics
383,Braiding Sweetgrass, offers some great ways for all of us to take better care of and be more grateful for our planet by explaining the way that Native Americans view and take care of it.,politics
384,Pandemic," gives you an understanding of what pathogens and diseases are, how they evolve, what our lifestyle does to make them worse on us, how they can spread like wildfire, and most importantly, what we can do to stop them.",politics
385,Chasing The Scream," is a scathing review of the failed war on drugs, explaining its history with surprising statistics and identifying new ways that we can think about addiction, recovery, and drug laws.",politics
386,Common Sense, is a classic piece of US history that will help you see the importance of societies coming together to form a fair governmental system and how these ideas paved the way for the American revolution.,politics
387,Age Of Ambition, explains how China has gone from impoverished and only developing to a world superpower and economic powerhouse in only the last 30 years. ,politics
388,Chernobyl," teaches some fascinating and important history, science, and leadership lessons by diving into the details of the events leading up to the worst nuclear disaster in human history and its aftermath.",politics
389,The Power Paradox," frames the concept of power in an inspiring new narrative, which can help us create better and more equal relationships, workplaces, and societies.",politics
390,Between The World And Me, helps us all fight prejudice and prepares young black men in the US for growing up by revealing Ta-Nehisi Coates’s reality of life as a black man dealing with racism in America.,politics
391,Born A Crime, will inspire you to make great things happen no matter what circumstances you’re born into by revealing the story of how Trevor Noah grew up as a mixed child in South Africa on the way to becoming an adult.,politics
392,Behind The Beautiful Forevers," will make you more grateful for what you have, look for ways to tear down corruption in the world, and help the poor by sharing the experiences of people living in the Annawadi slum in India.",politics
393,Becoming," will use Michelle Obama’s life story to motivate you to move forward with your dreams regardless of your circumstances, criticism, or what people think.",politics
394,Alexander Hamilton," will inspire you to boldly use your strengths to change the world as it tells the story of a poor orphan who grew to become one of the most intelligent, ambitious, and influential people in American history.",politics
395,A Woman of No Importance," tells the fascinating and exciting story of Virginia Hall, an American who became one of the best spies for the Allies in World War II and helped significantly in the defeat of Nazi Germany.",politics
396,A World In Disarray, will open your mind to new ways of making the world a more peaceful place by guiding you through the major changes in global affairs since World War II.,politics
397,Call Sign Chaos," is a review of US foreign policy through the eyes of General Jim Mattis, who led forces in Afghanistan and Iraq.",politics
398,23 Things They Don’t Tell You About Capitalism, will help you think more clearly about our current economic state by uncovering the hidden consequences of free-market capitalism and offering solutions that could give us all a more fair world.,politics
399,A Crack In Creation," will teach you all about the power of gene editing that is made possible with CRISPR by detailing how it works, the benefits and opportunities it opens up, and the ethical risks of using it on humans.",politics
400,A Vindication Of The Rights Of Woman, will help you make the world a more fair place by teaching some of the gender inequalities of the eighteenth century.,politics
401,A People’s History Of The United States," will help you improve the world by giving you a better understanding of the true, sometimes shameful, story of this America’s rise to power.",politics
