Unnamed: 0,book_name,summaries,categories
107,Broadcasting Happiness," is an encouraging resource that will help you boost your health and happiness in your relationships, work, and community by showing you how to unlock the power of positive words and stories.",science
108,The Joy Of Movement, is just what you need to finally find the motivation to get out and exercise more often by teaching you the scientific reasons why it’s good for you and why your body is designed to enjoy it.,science
109,The Immortal Life of Henrietta Lacks, makes you smarter and more compassionate by revealing the previously unknown story of a woman with extraordinary cells that still live today and have contributed to dozens of medical breakthroughs.,science
110,The Body Keeps The Score, teaches you how to get through the difficulties that arise from your traumatic past by revealing the psychology behind them and revealing some of the techniques therapists use to help victims recover.,science
111,How To Change Your Mind," reveals new evidence on psychedelics, confirming their power to cure mental illness, ease depression and addiction, and help people die more peacefully.  ",science
112,Maybe You Should Talk To Someone, will help you feel more comfortable with using therapy to improve your mental health by giving a candid look into how therapy really works from the point of view of an experienced therapist who also found herself needing it.,science
113,A General Theory Of Love, will help you reprogram your mind for better emotional intelligence and relationships by teaching you what three psychiatrists have to say about the science of why we experience love and other emotions.,science
114,The Little Book of Lykke, gives Danish-derived and science-backed tips that will help you be happier.,science
115,Why We Sleep, will motivate you get more and better quality sleep by showing you the recent scientific findings on why sleep deprivation is bad for individuals and society.,science
116,A Universe From Nothing," will enlarge your knowledge of our expanding universe by showing you how it began, what we’re learning about it now, and what will happen to it in the future.",science
117,A Crack In Creation," will teach you all about the power of gene editing that is made possible with CRISPR by detailing how it works, the benefits and opportunities it opens up, and the ethical risks of using it on humans.",science
118,How To," will help you get better at abstract thinking as it gives solutions to some of the strangest problems in the wackiest, but still scientific, ways.",science
119,A Mind For Numbers," will teach you how to learn math and science more efficiently and get good at them by understanding how your brain absorbs and processes information, even if these subjects don’t come naturally to you.",science
120,A Beautiful Mind," tells the fascinating story of the mathematical genius, mental illness, and miraculous recovery and success of John Nash Jr.",science
121,Feral, will help you find ways to improve the well-being of humanity by illustrating the deep connection between us and Nature and offering actionable advice on how to preserve balance in our ecosystems through rewilding.,science
122,Sleep Smarter, is a collection of 21 simple tips and tricks to optimize your sleep environment once and then reap the benefits of more restful nights forever.,science
123,What If," is a compilation of well-researched, science-based answers to some of the craziest hypothetical questions you can imagine.",science
124,Exploring The World Of Lucid Dreaming, is a practical guide to dreaming consciously which uncovers an invaluable channel of communication between your conscious and unconscious mind.,science
125,The Sports Gene," is a look at how genes affect our abilities, motivations, and endurance in sports, explaining why some people are better suited for certain sports than others.",science
126,The Brain That Changes Itself, explores the groundbreaking research in neuroplasticity and shares fascinating stories of people who can use the brain’s ability to adapt and be cured of ailments previously incurable. ,science
127,Psycho-Cybernetics," explains how thinking of the human mind as a machine can help improve your self-image, which will dramatically increase your success and happiness.",science
128,Altered Traits, explores the science behind meditation techniques and the way they benefit and alter our mind and body.,science
129,Merchants of Doubt," explains how a small but loud group of researchers were able to mislead the public about the truths around global warming, tobacco, DDT, and other important issues for decades. ",science
130,How Not To Die, delivers a template for extending your life based on scientific research which recommends switching to a mainly plant-based diet. ,science
131,Behave," sets out to explain the reason behind human behavior, good or bad, by exploring the influences of brain chemistry and our environment.",science
132,Brainstorm, is a fascinating look into the teenage brain that explains why adolescents act so hormonally and recklessly.,science
133,On The Origin Of Species, is the foundational book for modern evolutionary biology that marked a turning point in how we think about the beginnings of humankind.,science
134,How Emotions Are Made, explores the often misconstrued world of human feelings and the cutting-edge science behind how they’re formed.,science
135,Against Empathy, explains the problems with society’s obsession with empathy and explores its limitations while giving us useful alternatives for situations in which it doesn’t work.,science
136,The Biology of Belief," is an overview of the recent findings in cellular biology, which are redefining the way we look at evolution, genetics and the nature of life.",science
137,The Hidden Life of Trees," describes how trees can communicate, support each other, learn from experience, and form alliances with other inhabitants of the forest.",science
138,Silent Spring," is the story that sparked the global grassroots environmental movement in 1962, explaining how chemical pesticides work, what their drawbacks are, and how we can protect crops in better, more sustainable ways.",science
139,Aware," is a comprehensive overview of the far-reaching benefits of meditation, rooted in both science and practice, enriched with actionable advice on how to practice mindfulness. ",science
140,Lost Connections," explains why depression affects so many people and that improving our relationships, not taking medication, is the way to beat our mental health problems.",science
141,The Age of Empathy," explains that empathy comes natural to humans, as it does to most other animals, and that we’re not wired to be selfish and violent, but kind and cooperative.",science
142,Counterclockwise, is a critical look at current perspectives on health with a particular focus on how we can improve our own when we shift from being mindless to mindful.,science
143,The Yes Brain," offers parenting techniques that will give your kids an open attitude towards life, balance, resilience, insight, and empathy.",science
144,Born To Run," explains the natural benefits of long-distance running, and how you can become a better runner too, based on several years of research, experiences, and training.",science
145,The Tao of Physics," questions many biases about Western science and Eastern spirituality, showing the close connections between the principles of physics and those of Buddhism, Hinduism, and Taoism",science
146,Rest," examines why traditional methods of working too long and hard are inefficient compared to working less, resting, and playing to accomplish your best work.",science
147,The Blue Zones Solution," shows you how to adopt the lifestyle and mindset practices of the healthiest, longest-living people on the planet from the five locations with the highest population of centenarians.",science
148,"Write It Down, Make It Happen"," is a simple guide to help you accomplish your goals through the act of writing, showing you how to use this basic skill to focus, address fears, and stay motivated.",science
149,Atomic Habits," is the definitive guide to breaking bad behaviors and adopting good ones in four steps, showing you how small, incremental, everyday routines compound into massive, positive change over time.",science
150,Homo Deus, illustrates the history of the human race from how we came to be the dominant species over what narratives are shaping our lives today all the way to which obstacles we must overcome next to continue to thrive.,science
151,The Chimp Paradox," uses a simple analogy to help you take control of your emotions and act in your own, best interest, whether it’s in making decisions, communicating with others, or your health and happiness.",science
152,Factfulness," explains how our worldview has been distorted with the rise of new media, which ten human instincts cause erroneous thinking, and how we can learn to separate fact from fiction when forming our opinions.",science
153,Problem Solving 101," is a universal, four-step template for overcoming challenges in life, based on a traditional method Japanese school children learn early on.",science
154,Skin In The Game," is an assessment of asymmetries in human interactions, aimed at helping you understand where and how gaps in uncertainty, risk, knowledge, and fairness emerge, and how to close them.",science
155,When: The Scientific Secrets of Perfect Timing," breaks down the science of time so you can stop guessing when to do things and pick the best times to work, eat, sleep, have your coffee and even quit your job.",science
156,Leonardo Da Vinci," is Walter Isaacson’s account of the life of one of the most brilliant artists, thinkers, and innovators who ever lived.",science
157,Barking Up The Wrong Tree," turns standard success advice on its head by looking at both sides of many common arguments, like confidence, extroversion, or being nice, concluding it’s really other factors that decide if we win, and we control more of them than we think.",science
158,Emotional Agility," provides a new, science-backed approach to navigating life’s many trials and detours on your path to fulfillment, with which you’ll face your emotions head on, observe them objectively, make choices based on your values and slowly tweak your mindset, motivation and habits.",science
159,The Road Less Traveled," is a spiritual classic, combining scientific and religious views to help you grow by confronting and solving your problems through discipline, love and grace.",science
160,The Myth Of Multitasking," explains why doing everything at once is neither efficient, nor even possible, and gives you practical steps for more focus in the workplace.",science
161,Long-Term Thinking For A Short-Sighted World," explains why we rarely think about the long-term consequences of our actions, how this puts our entire species in danger and what we can do to change and ensure a thriving future for mankind.",science
162,Genius: The Life And Science Of Richard Feynman," tells the story of one the greatest minds in the history of science, all the way from his humble beginnings to changing physics as we know it and receiving the Nobel prize.",science
163,Payoff," unravels the complex construct that is human motivation and shows you how it consists of many more parts than money and recognition, such as meaning, effort and ownership, so you can motivate yourself not just today, but every day.",science
164,Peak," accumulates everything the pioneer researcher on deliberate practice has learned about expert performance through decades of exploration and analysis of what separates those, who are average, from those, who are world-class at what they do.",science
165,The Habit Blueprint," strips down behavior change to its very core, giving you the ultimate, research-backed recipe for cultivating the habits you desire, with plenty of backup steps you can take to maximize your chances of success.",science
166,Decisive," gives you a scientific, 4-step approach to making better decisions in your life and career, based on an extensive study of the available literature and research on the topic.",science
167,A Short History Of Nearly Everything," explains everything we’ve learned about our world and the universe so far, including how they formed, how we learned to make sense of time, space and gravity, why it’s such a miracle that we’re alive and how much of our planet is still a complete mystery to us.",science
168,The Art Of Choosing," extensively covers the scientific research made about human decision making, showing you what affects how you make choices, how the consequences of those choices affect you, as well as how you can adapt to these circumstances to make better decisions in the future.",science
169,Forensics: The Anatomy Of Crime," gives you an inside looks at all the different fields of criminal forensics and their history, showing you how the investigation and evidence-collection of crimes has changed dramatically within the last 200 years, helping us find the truth behind more and more crimes.",science
170,The Magic Of Reality," explains many of the world’s natural phenomenons in a scientific way, so that you can understand how the elementary components of our planet work together to logically, yet beautifully, create the place we all call home.",science
171,The End Of Average," explains the fundamental flaws with our culture of averages, in which we design everything for the average person, when that person doesn’t exist, and shows how we can embrace our individuality and use it to succeed in a world that wants everyone to be the same.",science
172,How Not To Be Wrong," shows you that math is really just the science of common sense and that studying a few key mathematical ideas can help you assess risks better, make the right decisions, navigate the world effortlessly and be wrong a lot less.",science
173,Grit," describes what creates outstanding achievements, based on science, interviews with high achievers from various fields and the personal history of success of the author, Angela Duckworth, uncovering that achievement isn’t reserved for the talented only, but for those with passion and perseverance.",science
174,Made To Stick," examines advertising campaigns, urban myths and compelling stories to determine the six traits that make ideas stick in our brains, so you don’t just know why you remember some things better than others, but can also spread your own ideas more easily among the right people.",science
175,The Botany Of Desire," describes how, contrary to popular belief, we might not be using plants as much as plants use us, by getting humans to ensure their survival, thanks to appealing to our desires for beauty, sweetness, intoxication and control.",science
176,The Magic of Math," shows you not only the power, but also the beauty of mathematics, unlike you’ve ever seen it in school and with practical, real-world applications.",science
177,The Genius Of Birds," shines a new light on a genuinely underrated kind of vertebrate by explaining birds’ capacities to be social, intelligently solve challenges, learn languages, be artistic and navigate the planet.",science
178,The Evolution Of Everything," compares creationist to evolutionist thinking, showing how the process of evolution we know from biology underlies and permeates the entire world, including society, morality, religion, culture, economics, money, innovation and even the internet.",science
179,The Singularity Is Near," outlines the future of technology by describing how change keeps accelerating, what computers will look like and be made of, why biology and technology will become indistinguishable and how we can’t possibly predict what’ll happen after 2045.",science
180,The Selfish Gene," explains the process of evolution in biology using genes as its basic unit, showing how they manifest in the form of organisms, what they do to ensure their own survival, how they program our brains, which strategies have worked best throughout history and what makes humans so special in this context.",science
181,Elon Musk," is the first official biography of the creator of SolarCity, SpaceX and Tesla, based on over 30 hours of conversation time between author Ashlee Vance",science
182,Einstein: His Life And Universe," takes a close look at the life of Albert Einstein, beginning in how his childhood shaped him, what his biggest discoveries and personal struggles were and how his focus changed in later years, without his genius ever fading until his very last moment.",science
183,Smarter," is one “slow learner” turned A student’s experimental account of improving his intelligence by 16% through various tests, lessons and exercises and explains how you can increase your intelligence in scientifically proven ways.",science
184,Hackers and Painters," is a collection of essays by Y Combinator founder Paul Graham about what makes a good computer programmer and how you can code the future if you are one, making a fortune in the process.",science
185,Everything Is Obvious," shows you that common sense isn’t as reliable as you think it is, because it often fails us in helping to make predictions, and how you can change the way you or your company make decisions with more scientific, statistically grounded methods.",science
186,Oxygen," helps you understand the biology of our evolution by taking a close look at the molecule that can make and break all life and how it’s shaped the rise of animals, plants and humans, as well as why it might be the key to ending aging.",science
187,Predictably Irrational," explains the hidden forces that really drive how we make decisions, which are far less rational than we think, but can help us stay on top of our finances, interact better with others and live happier lives, once we know about them.",science
188,The Talent Code," cracks open the myth of talent and breaks it down from a neurological standpoint into three crucial parts, which anyone can pull together to become a world-class performer, artist, or athlete and form something they used to believe was not even within their own hands.",science
189,Abundance," shows you the key technological trends being developed today, to give you a glimpse of a future that’s a lot brighter than you think and help you embrace the optimism we need to make it happen.",science
190,Why We Love," delivers a scientific explanation for love, shows you how it developed historically and evolutionarily, tells you what we’re all attracted to and where we differ, and of course gives you actionable advice to deal with both the exciting, successful romance in your life, as well as its sometimes inevitable fallout.",science
191,Freakonomics," helps you make better decisions by showing you how your life is dominated by incentives, how to close information asymmetries between you and the experts that exploit you and how to really tell the difference between causation and correlation.",science
192,The Blue Zones," gives you advice on how to live to be 100 years and older by looking at five spots across the planet, where people live the longest, and drawing lessons about what they eat, drink, how they exercise and which habits most shape their lives.",science
193,The China Study, examines the effect of animal protein intake on cancer risk and suggests improving your health by focusing on a plant-based diet.,science
194,Drive, explores what has motivated humans throughout history and explains how we shifted from mere survival to the carrot and stick approach that’s still practiced today – and why it’s outdated.,science
195,The Happiness Project," will show you how to change your life, without actually changing your life, thanks to the findings of modern science, ancient history and popular culture about happiness, which the author tested for a year and now shares with you.",science
196,Immunity," is an introductory guide to how your immune system works, why it’s a double-edged sword, and which laws govern its existence.",science
197,Outliers," explains why “the self-made man” is a myth and what truly lies behind the success of the best people in their field, which is often a series of lucky events, rare opportunities and other external factors, which are out of our control.",science
198,Your Brain At Work," helps you overcome the daily challenges that take away your brain power, like constant email and interruption madness, high levels of stress, lack of control and high expectations, by showing you what goes on inside your head and giving you new approaches to control it better.",science
199,Willpower," is a blend of practical tips and the latest scientific research on self-control, explaining how willpower works, what you can do to improve it, how to optimize it and which steps to take when it fails you.",science
200,Talent Is Overrated," debunks both talent and experience as the determining factors and instead makes a case for deliberate practice, intrinsic motivation and starting early.",science
201,The Power Of Habit," helps you understand why habits are at the core of everything you do, how you can change them, and what impact that will have on your life, your business and society.",science
202,Bounce," shows you that training trumps talent every time, by explaining the science of deliberate practice, the mindset of high performers and how you can use those tools to become a master of whichever skill you choose.",science
203,Salt Sugar Fat," takes you through the history of the demise of home-cooked meals by explaining why you love salt, sugar and fat so much and how the processed food industry managed to hook us by cramming all 3 of those into their products.",science
204,Sex at Dawn," challenges conventional views on sex by diving deep into our ancestors’ sexual history and the rise of monogamy, thus prompting us to rethink our understanding of what sex and relationships should really feel and be like.",science
205,A Brief History Of Time," is Stephen Hawking’s way of explaining the most complex concepts and ideas of physics, such as space, time, black holes, planets, stars and gravity to the average Joe, so that even you and I can better understand how our planet was created, where it came from, and where it’s going.",science
206,Stumbling On Happiness," examines the capacity of our brains to fill in gaps and simulate experiences, shows how our lack of awareness of these powers sometimes leads us to wrong decisions, and how we can change our behavior to synthesize our own happiness.",science
207,Moonwalking With Einstein," not only educates you about the history of memory, and how its standing has declined over centuries, but also gives you actionable techniques to extend and improve your own.",science
208,Why Is Sex Fun," takes a humorous look at the evolution of human sex life, explaining why the way we behave sexually is often odd, but necessary for our survival.",science
209,The Light We Carry," is a set of practices to help you stay calm, optimistic, and confident in an unpredictable world, based on Michelle Obama’s life experiences as a woman, mother, lawyer, daughter, leader, and the former First Lady of the United States.",biography
210,Dear Girls," is a collection of letters written by comedian Ali Wong to her two daughters, recounting tales from her youth and life in an attempt to pass on some hard-earned wisdom to them and anyone willing to listen to her story.",biography
211,On Writing, details Stephen King’s journey to becoming one of the best-selling authors of all time while delivering hard-won advice on the craft to aspiring writers.,biography
212,Never Finished," is an inspiring blueprint for leveling up in the game of life that never ends, offering 8 evolutions of thought, painful truths, and motivating stories to help you smash any and all glass ceilings in your life.",biography
213,Will," is world-famous actor and musician Will Smith’s autobiography, outlining his life’s story all the way from his humble beginnings in West Philadelphia to achieving fame as a musician and then global stardom as an actor and, ultimately, one of the most influential people of our time.",biography
214,The Code Breaker," details the life of Nobel Prize winner Jennifer Doudna, who embarked on — and successfully completed — a journey to invent a tool that allows us to edit the human genetic code and thus will change our lives, health, and future generations forever.",biography
215,Siddhartha," presents the self-discovery expedition of a man during the time of the Buddha who, unsure of what life really means to him, takes an exploratory journey to pursue the highs and lows of life, which ultimately leads him to discover the equilibrium in all things and a higher wisdom within.",biography
216,Permanent Record," delves into the life story of Edward Snowden, the well-renowned national whistleblower who built the exposé on STELLARWIND, the US mass surveillance program used to spy on American citizens.",biography
217,The Undoing Project, talks about the life and extensive research in the psychology of Kahneman and Tversky by bringing forth some of the most influential and groundbreaking discoveries they unveiled about human behavior and the biases in our decisions.,biography
218,Love Warrior," delves into the life of Glennon Doyle, a woman who battled with self-destructive behaviors, eating disorders, depression, and many more challenges before finally embracing the life she deserved and started living meaningfully while being true to herself.",biography
